agua	bioapps	0.6.0	/agua/0.6.0/bioapps	clusterMAQ	pipeline	inputfile	0	0	input	inputfile	file	--inputfile		essential					
agua	bioapps	0.6.0	/agua/0.6.0/bioapps	bowtieIndex	converter	outputdir	1	0	input	inputdir	directory	--outputdir		required		Print indexed files to this directory	input.referencedir.value, input.outputdir.value, input.inputdir.value		
agua	bioapps	0.6.0	/agua/0.6.0/bioapps	maqIndex	converter	subdirs	1	0	input	subdirs	flag	--subdirs	1	optional			input.subdirs.value		
agua	bioapps	0.6.0	/agua/0.6.0/bioapps	maqIndex	converter	outputdir	1	0	input	outputdir	directory	--outputdir		         		Print indexed files to this directory	output.referencedir.value, input.outputdir.value, input.inputdir.value\			\N
agua	bioapps	0.6.0	/agua/0.6.0/bioapps	bowtieIndex	converter	subdirs	1	1	input	subdirs	flag	--subdirs	1	optional			input.subdirs.value		
agua	bioapps	0.6.0	/agua/0.6.0/bioapps	unzipFiles	utility	delete	1	0	input	delete	flag	--delete	1	optional		Remove zipped files after unzipping			
agua	bioapps	0.6.0	/agua/0.6.0/bioapps	unzipFiles	utility	regex	0	0	input	filter	string	--regex	\	chr[XYM0-9]+\\.fa\\.gz	optional		Unzip only files matching this regular expression	input.regex.value		\N
agua	bioapps	0.6.0	/agua/0.6.0/bioapps	jbrowseFeatures	view	maxjobs	0	0	input	maxjobs	integer	--maxjobs		optional		Maximum number of jobs to be running or queued concurrently (default: 100)			
agua	bioapps	0.6.0	/agua/0.6.0/bioapps	jbrowseFeatures	view	sleep	0	0	input	sleep	integer	--sleep		optional		Length of sleep in seconds between queue polls (default: 5)			
agua	bioapps	0.6.0	/agua/0.6.0/bioapps	chopfile	utility	outputfile	1	0	input	inputfile	file	--outputfile		required		Print lines to this target file			
agua	bioapps	0.6.0	/agua/0.6.0/bioapps	chopfile	utility	lines	1	0	input	lines	integer	--lines		required		Print this number of lines			
agua	bioapps	0.6.0	/agua/0.6.0/bioapps	chopfile	utility	offset	1	0	input	lines	integer	--offset		optional		Start printing lines from the inputfile after this number of lines			
agua	bioapps	0.6.0	/agua/0.6.0/bioapps	chopfile	utility	outputfile	1	0	output	outputfile	file			optional		File containing the user-specified number of lines from the inputfile, starting from the offset (default: 0)	input.outputfile.value		
agua	bioapps	0.6.0	/agua/0.6.0/bioapps	chopfile	utility	inputfile	1	0	input	inputfile	file	--inputfile		essential		Print lines from this source file	output.outputfile.value,input.outputfile.value		
agua	bioapps	0.6.0	/agua/0.6.0/bioapps	maqIndex	converter	inputdir	1	0	input	inputdir	directory	--inputdir		essential		Location of directory containing *.fa files	output.referencedir.value, input.outputdir.value, input.inputdir.value\			\N
agua	bioapps	0.6.0	/agua/0.6.0/bioapps	novoIndex	converter	outputdir	1	0	input	outputdir	directory	--outputdir		         		Print indexed files to this directory	output.referencedir.value, input.outputdir.value, input.inputdir.value		
agua	bioapps	0.6.0	/agua/0.6.0/bioapps	novoIndex	converter	inputdir	1	0	input	inputdir	directory	--inputdir		essential		Location of directory containing *.fa files	output.referencedir.value, input.outputdir.value, input.inputdir.value		
