agua	bioapps	0.6.0	/agua/0.6.0/bioapps	clusterMAQ	pipeline	inputfile	0	0	input	inputfile	file	--inputfile		essential					
agua	bioapps	0.6.0	/agua/0.6.0/bioapps	clusterMAQ	pipeline	outputdir	0	0	input	outputdir	directory	--outputdir	%project%/%workflow%	essential	dir	Absolute path to directory containing reference_sequences.2bpb, .idx and .vld files	inputs.acefile.value	acefile	var outputdir = acefile
agua	bioapps	0.6.0	/agua/0.6.0/bioapps	clusterMAQ	pipeline	referencefile	0	0	input	referencefile	file	--referencefile		required					
agua	bioapps	0.6.0	/agua/0.6.0/bioapps	clusterMAQ	pipeline	sortedfile	0	0	output	sortedfile	file		%project%/%workflow%/s_1_1_sorted.txt	required					
agua	bioapps	0.6.0	/agua/0.6.0/bioapps	deepvac.pl	utility	downloaddir	0	0	input	downloaddir	directory	--downloaddir	%project%/%workflow%/download	required		Files are downloaded to this directory			
agua	bioapps	0.6.0	/agua/0.6.0/bioapps	deepvac.pl	utility	filter	0	0	input	filter	string	--filter		optional		Download only filenames containing this name fragment			
agua	bioapps	0.6.0	/agua/0.6.0/bioapps	deepvac.pl	utility	regex	0	0	input	regex	string	--regex		optional		Download only filenames matching this regex			
agua	bioapps	0.6.0	/agua/0.6.0/bioapps	deepvac.pl	utility	url	0	0	input	url	string	--url		required		URL of FTP site or link to file on web page			
agua	bioapps	0.6.0	/agua/0.6.0/bioapps	deepvac.pl	utility	type	0	0	input	type	string	--type		required		Type of page: 'html' or 'text'			
agua	bioapps	0.6.0	/agua/0.6.0/bioapps	elandHeader	converter	inputfile	0	0	input	readfile 	file	--inputfile	%project%/%workflow%/sequence.txt	essential		FASTQ file not in ELAND format (for use with ELAND_standalone.pl)	output.outputfile.value		
agua	bioapps	0.6.0	/agua/0.6.0/bioapps	ELAND	aligner	inputtype	0	0	input	inputtype	string	--inputtype	fastq	required		Type of input sequence. Valid inputs: fastq, fasta, export or qseq			
agua	bioapps	0.6.0	/agua/0.6.0/bioapps	ELAND	aligner	outputdir	0	0	input	outputdir	directory	--outputdir	%project%/%workflow%	required		Print ELAND alignment files to this directory (will create the directory if it does not exist)			
agua	bioapps	0.6.0	/agua/0.6.0/bioapps	ELAND	aligner	matefile	0	0	input	matefile	file	--matefile		optional	fastq	Paired-end mate file complementary to inputfile (e.g., s_1_2_sequence.fastq)	output.matefile.value,input.matefile.value	input1,input2	
agua	bioapps	0.6.0	/agua/0.6.0/bioapps	ELAND	aligner	hits	1	0	output	hits	files			optional		Chromosome-specific *bam files containing aligned reads	input.outputdir.value	outputdir	return outputdir + /chr*/hit.bam;
agua	bioapps	0.6.0	/agua/0.6.0/bioapps	ELAND	aligner	pairparams	0	0	input	pairparams	string	--pairparams		optional		Paired read analysis parameters to pass to pickBestPair. Default: '--circular' (treats all chromosomes as circular).			
agua	bioapps	0.6.0	/agua/0.6.0/bioapps	ELAND	aligner	quality	0	0	input	quality	integer	--quality		optional		Quality value of all bases in fasta mode (Default: 30)			
agua	bioapps	0.6.0	/agua/0.6.0/bioapps	ELAND	aligner	reads	0	0	input	reads	integer	--reads	1000000	optional		Number of reads per sub-file			
agua	bioapps	0.6.0	/agua/0.6.0/bioapps	ELAND	aligner	referencedir	0	0	input	referencedir	directory	--referencedir	%project%/%workflow%	essential		Directory containing squashed reference genome files			
agua	bioapps	0.6.0	/agua/0.6.0/bioapps	ELAND	aligner	seedlength	0	0	input	seedlength	integer	--seedlength		optional		Length of read used for ELAND alignment (Default: min. of seedlength and 32)			
agua	bioapps	0.6.0	/agua/0.6.0/bioapps	ELAND	aligner	splitfile	0	0	input	splitfile	file	--splitfile		optional					
agua	bioapps	0.6.0	/agua/0.6.0/bioapps	eland2ace.pl	converter	inputfile	0	0	input	inputfile	file	--inputfile		required	ace		output.sortedfile.value		
agua	bioapps	0.6.0	/agua/0.6.0/bioapps	eland2ace.pl	converter	outputdir	0	0	input	outputdir	directory	--outputdir	%project%/%workflow%/dummy	required	dir		input.outputdir.value		
agua	bioapps	0.6.0	/agua/0.6.0/bioapps	eland2ace.pl	converter	outputfile	0	0	output	outputfile	file			Discretion	ace		input.inputfile.value	inputfile	return inputfile.replace(/.txt/, '.ace')
agua	bioapps	0.6.0	/agua/0.6.0/bioapps	filterSNP	report	species	0	0	input	species	string	--species		required					
agua	bioapps	0.6.0	/agua/0.6.0/bioapps	filterSNP	report	sense	0	0	input	sense	string	--sense		optional					
agua	bioapps	0.6.0	/agua/0.6.0/bioapps	filterSNP	report	quality	0	0	input	quality	integer	--quality		optional					
agua	bioapps	0.6.0	/agua/0.6.0/bioapps	filterSNP	report	outputdir	0	0	output	outputdir	directory	--outputdir	%project%/%workflow%	required		Directory with one subdirectory per reference chromosome, each containing an out.sav.flt filterSNP output file	input.inputdir.value		
agua	bioapps	0.6.0	/agua/0.6.0/bioapps	filterSNP	report	inputdir	0	0	input	inputdir	directory	--inputdir	%project%/%workflow%	essential		Directory with one subdirectory per reference chromosome, each containing an out.sav extended pileup format file of predicted SNPs and annotation information	output.outputdir.value		
agua	bioapps	0.6.0	/agua/0.6.0/bioapps	filterSNP	report	coverage	0	0	input	coverage	integer	--coverage		optional					
agua	bioapps	0.6.0	/agua/0.6.0/bioapps	filterSNP	report	filename	0	0	input	filename	file	--filename		optional					
agua	bioapps	0.6.0	/agua/0.6.0/bioapps	filterSNP	report	chromosome	0	0	input	chromosome	string	--chromosome		optional					
agua	bioapps	0.6.0	/agua/0.6.0/bioapps	FTP	utility	url	0	0	input	url	string	--url		required		Download files linked on this page			
agua	bioapps	0.6.0	/agua/0.6.0/bioapps	FTP	utility	type	0	0	input	type	string	--type		essential		Type of page: html or text			
agua	bioapps	0.6.0	/agua/0.6.0/bioapps	FTP	utility	filter	0	0	input	filter	string	--filter		optional		Download only files containing this text fragment			
agua	bioapps	0.6.0	/agua/0.6.0/bioapps	FTP	utility	regex	0	0	input	regex	string	--regex	\	chr[XYM0-9]+\\.fa\\.gz	optional		Download files matching this regular expression			\N
agua	bioapps	0.6.0	/agua/0.6.0/bioapps	FTP	utility	outputdir	0	0	input	outputdir	directory	--outputdir	%project%/%workflow%/downloads	required		Create this directory and download files to it			
agua	bioapps	0.6.0	/agua/0.6.0/bioapps	GSMAPPER	pipeline	inputfiles	0	0	input	inputfiles	files	--inputfiles	%project%/%workflow%/sample1.fna	essential		Comma-separated list of input FASTA files			
agua	bioapps	0.6.0	/agua/0.6.0/bioapps	GSMAPPER	pipeline	outputdirs	0	0	input	outputdirs	directories	--outputdirs	%project%/%workflow%/sample1	required		Comma-separated list of output directories (one per input file)			
agua	bioapps	0.6.0	/agua/0.6.0/bioapps	GSMAPPER	pipeline	referencefile	0	0	input	outputdirs	file	--referencefile	%project%/%workflow%/myReference.fna	essential		Reference sequence FASTA file			
agua	bioapps	0.6.0	/agua/0.6.0/bioapps	GSMAPPER	pipeline	queue	0	0	input	queue	string	-queue	-qgsmall	optional		Optional cluster queue parameters			
agua	bioapps	0.6.0	/agua/0.6.0/bioapps	GSMAPPER	pipeline	HCsnps	0	0	output	queue	files			optional		High-confidence predicted SNPs			
agua	bioapps	0.6.0	/agua/0.6.0/bioapps	GSMAPPER	pipeline	Allsnps	0	0	output	queue	files			optional		All predicted SNPs			
agua	bioapps	0.6.0	/agua/0.6.0/bioapps	image2eland.pl	pipeline	inputfile	0	0	input	inputfile	file	--inputfile		essential					
agua	bioapps	0.6.0	/agua/0.6.0/bioapps	image2eland.pl	pipeline	outputdir	0	0	input	outputdir	directory	--outputdir	%project%/%workflow%	essential					
agua	bioapps	0.6.0	/agua/0.6.0/bioapps	image2eland.pl	pipeline	outputfile	0	0	output	outputfile	file	--outputfile		required					
agua	bioapps	0.6.0	/agua/0.6.0/bioapps	image2eland.pl	pipeline	sortedfile	0	0	output	sortedfile	file		%project%/%workflow%/s_1_1_sorted.txt	required					
agua	bioapps	0.6.0	/agua/0.6.0/bioapps	MAQ	pipeline	clean	0	0	input	clean	flag	--clean		optional		Clean run (remove old splitfile)	input.clean.value		
agua	bioapps	0.6.0	/agua/0.6.0/bioapps	MAQ	pipeline	convert	0	0	input	convert	flag	--convert	%project%/%workflow%	optional		Convert from Solexa FASTQ to Sanger FASTQ	input.convert.value		
agua	bioapps	0.6.0	/agua/0.6.0/bioapps	MAQ	pipeline	inputfile	0	0	input	inputfile	file	--inputfile	%project%/%workflow%/s_1_1_sequence.fastq	essential		Single read or first paired-end sequence file	input.inputfile.value		
agua	bioapps	0.6.0	/agua/0.6.0/bioapps	MAQ	pipeline	label	0	0	input	label	String	--label		required		A one-word label describing the experiment or data	input.label.value		
agua	bioapps	0.6.0	/agua/0.6.0/bioapps	MAQ	pipeline	matefile	0	0	input	matefile	file	--matefile	%project%/%workflow%/s_1_2_sequence.fastq	essential		Second paired-end sequence file	input.matefile.value		
agua	bioapps	0.6.0	/agua/0.6.0/bioapps	MAQ	pipeline	maxjobs	0	0	input	jobs	integer	--jobs	30	optional		Maximum number of concurrently queued or running jobs on the cluster queue for this run (Default: 30)	input.jobs.value		
agua	bioapps	0.6.0	/agua/0.6.0/bioapps	MAQ	pipeline	outputdir	0	0	input	outputdir	directory	--outputdir	%project%/%workflow%	required		Output alignment and SNP files will be printed to this directory	input.outputdir.value		
agua	bioapps	0.6.0	/agua/0.6.0/bioapps	MAQ	pipeline	queue	0	0	input	queue	string	--queue	-qgsmall	optional		Submit to a particular queue or add other submission options	input.queue.value		
agua	bioapps	0.6.0	/agua/0.6.0/bioapps	MAQ	pipeline	reads	0	0	input	reads	integer	--reads	1000000	optional		Number of reads per batch input file (Default = 1 million)	input.reads.value		
agua	bioapps	0.6.0	/agua/0.6.0/bioapps	MAQ	pipeline	referencedir	0	0	input	referencedir	directory	--referencedir	/nethome/bioinfo/data/sequence/chromosomes/human-bfa	essential		Directory containing MAQ format binary fasta (.bfa) files for all human chromosomes	input.referencedir.value		
agua	bioapps	0.6.0	/agua/0.6.0/bioapps	MAQ	pipeline	species	0	0	input	species	String	--species		required		Species name (e.g., human, mouse)	input.species.value		
agua	bioapps	0.6.0	/agua/0.6.0/bioapps	MAQ	pipeline	splitfile	0	0	input	splitfile	file	--splitfile	%project%/%workflow%	optional		File containing list of batch input sequence file locations	input.splitfile.value		
agua	bioapps	0.6.0	/agua/0.6.0/bioapps	MAQ	pipeline	consensus	0	0	output	cns-maq	file		%project%/%workflow%/cns.fq	Discretion	fastq	Consensus sequence and qualities in FASTQ format			
agua	bioapps	0.6.0	/agua/0.6.0/bioapps	MAQ	pipeline	dupfile	0	0	output	dupfile	file		%project%/%workflow%/rmdup.map	Discretion		Same as out.map file but with duplicate reads aligned against the reference with identical outer coordinates removed			
agua	bioapps	0.6.0	/agua/0.6.0/bioapps	MAQ	pipeline	hzsnps-filter	0	0	output	indelsoa	file		%project%/%workflow%/out.indelsoa.filter	Discretion		Filtered predicted homozygous indels			
agua	bioapps	0.6.0	/agua/0.6.0/bioapps	MAQ	pipeline	indelsoa	0	0	output	indelsoa	file		%project%/%workflow%/out.indelsoa	Discretion		Predicted homozygous indels			
agua	bioapps	0.6.0	/agua/0.6.0/bioapps	MAQ	pipeline	mapfile	0	0	output	mapfile	file		%project%/%workflow%/out.map	Discretion		Binary mapping file containing alignment of all reads against reference			
agua	bioapps	0.6.0	/agua/0.6.0/bioapps	MAQ	pipeline	PE-indels	0	0	output	indelpe	string		%project%/%workflow%/out.indelpe	Discretion		Indel calls, only produced with paired-end reads			
agua	bioapps	0.6.0	/agua/0.6.0/bioapps	MAQ	pipeline	snp	0	0	output	indelsoa.filter	file		%project%/%workflow%/cns.snp	Discretion		List of raw SNPs extracted from comparison of consensus and reference files			
agua	bioapps	0.6.0	/agua/0.6.0/bioapps	MAQ	pipeline	snp-filter	0	0	output	SNPfilter	file		%project%/%workflow%/out.SNPfilter	Discretion		Filtered SNP predictions based on indelsoa, indelpe and cns.snp files			
agua	bioapps	0.6.0	/agua/0.6.0/bioapps	replaceString.pl	utility	inputfile	0	0	input	inputfile	file	--inputfile		required					
agua	bioapps	0.6.0	/agua/0.6.0/bioapps	replaceString.pl	utility	outputdir	0	0	input	outputdir	directory	--outputdir		required					
agua	bioapps	0.6.0	/agua/0.6.0/bioapps	replaceString.pl	utility	outputfile	0	0	output	outputfile	file	--outputfile		required					
agua	bioapps	0.6.0	/agua/0.6.0/bioapps	SAV	pipeline	outputdir	0	0	output	outputdir	directory	--outputdir	%project%/%workflow%	required		Directory with one subdirectory per reference chromosome, each containing an out.sav output file	input.inputdir.value		
agua	bioapps	0.6.0	/agua/0.6.0/bioapps	SAV	pipeline	dbsnp	0	0	input	dbsnp	string	--dbsnp	snp130	optional		dbSNP version for given species			
agua	bioapps	0.6.0	/agua/0.6.0/bioapps	SAV	pipeline	inputdir	0	0	input	inputdir	directory	--inputdir	%project%/%workflow%	required		Directory with one subdirectory per reference chromosome, each containing an out.sam or out.bam alignment output file	input.outputdir.value,output.outputdir.value	outdir1,outdir2	if ( outdir1 != null && outdir1 !=  ) return outdir1; if ( outdir2 != null && outdir2 !=  ) return outdir2;
agua	bioapps	0.6.0	/agua/0.6.0/bioapps	SAV	pipeline	referencedir	0	0	input	referencedir	directory	--referencedir	/nethome/bioinfo/data/sequence/chromosomes/human/hg19/fasta	essential		Location of directory containing chr*.fa reference files			
agua	bioapps	0.6.0	/agua/0.6.0/bioapps	SAV	pipeline	species	0	0	input	species	string	--species	human	required		Name of the reference species (e.g., human, mouse)			
agua	bioapps	0.6.0	/agua/0.6.0/bioapps	splitace.pl	utility	inputfile	0	0	input	inputfile	file	--inputfile		essential			output	outputfiles	console.log('Doing paramFunction. outputfiles: ' + dojo.toJson(outputfiles)); for (var i in outputfiles) { console.log('outputfiles[' + i + ']: ' + dojo.toJson(outputfiles[i], true)); if ( outputfiles[i].format == 'ace') { return outputfiles[i].value
agua	bioapps	0.6.0	/agua/0.6.0/bioapps	splitace.pl	utility	outputdir	0	0	input	outputdir	directory	--outputdir		required			input.outputdir.value	outputdir	return outputdir + /splitace
agua	bioapps	0.6.0	/agua/0.6.0/bioapps	splitace.pl	utility	outputfiles	0	0	output	outputfiles	files	--outputfiles		Discretion	ace		input.outputdir.value	outputdir	return outputdir + /*.ace
agua	bioapps	0.6.0	/agua/0.6.0/bioapps	test1	pipeline	inputfile	0	0	input	inputfile	file	--inputfile		required					
agua	bioapps	0.6.0	/agua/0.6.0/bioapps	test1	pipeline	outputdir	0	0	input	outputdir	directory	--outputdir		required					
agua	bioapps	0.6.0	/agua/0.6.0/bioapps	test2	converter	inputfile	0	0	input	inputfile	file	--inputfile		required					
agua	bioapps	0.6.0	/agua/0.6.0/bioapps	test2	converter	outputdir	0	0	input	outputdir	directory	--outputdir		required					
agua	bioapps	0.6.0	/agua/0.6.0/bioapps	TOPHAT	aligner	cpus	0	0	input	cpus	integer	--cpus		optional		Max. number of cpus per job (1 to 4) (DEFAULT = 4)			
agua	bioapps	0.6.0	/agua/0.6.0/bioapps	TOPHAT	false	distance	0	0	input	distance	integer	--distance	200	required		The  mean inner distance between first read and its mate pair (corresponds to -r/--mate-inner-dist argument to Tophat)			
agua	bioapps	0.6.0	/agua/0.6.0/bioapps	TOPHAT	false	inputfiles	0	0	input	inputfiles	file	--inputfiles		required		Comma-separated *sequence.txt file names (e.g., s_1_1_sequence.txt,s_2_1_sequence.txt)			
agua	bioapps	0.6.0	/agua/0.6.0/bioapps	TOPHAT	aligner	jobs	0	0	input	jobs	integer	--jobs		optional		Max. number of concurrent cluster jobs (DEFAULT = 30)			
agua	bioapps	0.6.0	/agua/0.6.0/bioapps	TOPHAT	aligner	keep	0	0	input	keep	flag	--keep		optional		Keep intermediate files			
agua	bioapps	0.6.0	/agua/0.6.0/bioapps	TOPHAT	aligner	label	0	0	input	label	string	--label		required		Name to used to submit jobs to cluster (e.g., tophat-sample1)			
agua	bioapps	0.6.0	/agua/0.6.0/bioapps	TOPHAT	false	matefiles	0	0	input	matefiles	file	--matefiles		optional		Comma-separated *sequence.txt mate file names (e.g., s_1_2_sequence.txt,s_2_2_sequence.txt) with locations as paths relative to the output directory			
agua	bioapps	0.6.0	/agua/0.6.0/bioapps	TOPHAT	aligner	outputdir	0	0	input	outputdir	directory	--outputdir		required		Create this directory and write output files to it			
agua	bioapps	0.6.0	/agua/0.6.0/bioapps	TOPHAT	aligner	params	0	0	input	params	string	--params		optional		Additional parameters to be passed to tophat (e.g., --solexa1.3-quals			
agua	bioapps	0.6.0	/agua/0.6.0/bioapps	TOPHAT	aligner	queue	0	0	input	queue	string	--queue		optional		Cluster queue options			
agua	bioapps	0.6.0	/agua/0.6.0/bioapps	TOPHAT	aligner	reference	0	0	input	reference	file	--reference		required		Location of indexed reference file  (NB: Use file stub, e.g., /some/path/hg19)			
agua	bioapps	0.6.0	/agua/0.6.0/bioapps	TOPHAT	aligner	coverage	0	0	output	coverage	file		%project%/%workflow%/coverage.wig	Discretion		A UCSC BedGraph wigglegram track, showing the depth of coverage at each position, including the spliced read alignments.			
agua	bioapps	0.6.0	/agua/0.6.0/bioapps	TOPHAT	aligner	hits	0	0	output	hits	file		%project%/%workflow%/accepted_hits.sam	Discretion		A list of read alignments in SAM format. SAM is a compact short read alignment format that is increasingly being adopted.			
agua	bioapps	0.6.0	/agua/0.6.0/bioapps	TOPHAT	aligner	junctions	0	0	output	junctions	file		%project%/%workflow%/junctions.bed	Discretion		A UCSC BED track of junctions reported by TopHat. Each junction consists of two connected BED blocks, where each block is as long as the maximal overhang of any read spanning the junction. The score is the number of alignments spanning the junction.			
agua	bioapps	0.6.0	/agua/0.6.0/bioapps	ELAND	false	species	0	1	input	species	string	--species	human	required		Name of species, e.g., human, mouse, rat.			
agua	bioapps	0.6.0	/agua/0.6.0/bioapps	indexReads	false	samfiles	0	0	input	samfiles	files	--samfiles		essential		Comma-separated list of SAM-format hit files			
agua	bioapps	0.6.0	/agua/0.6.0/bioapps	indexReads	false	dbfile	0	0	input	dbfile	file	--dbfile		required		Print B-tree index to this file			
agua	bioapps	0.6.0	/agua/0.6.0/bioapps	sleep	false	seconds	0	0	input	sleep	integer	--seconds	10	optional					
agua	bioapps	0.6.0	/agua/0.6.0/bioapps	jbrowseFeatures	view	inputdir	0	0	input	inputdir	directory	--inputdir	%project%/%workflow%	essential		Directory with chromosome subdirs containing input files. JBrowse output files will be printed to subdirs	input.outputdir.value,output.outputdir.value	outdir1,outdir2	if ( outdir1 != null && outdir1 !=  ) return outdir1; if ( outdir2 != null && outdir2 !=  ) return outdir2;
agua	bioapps	0.6.0	/agua/0.6.0/bioapps	jbrowseFeatures	false	label	0	0	input	label	string	--label		required		Label for experiment (e.g., bowtie)	input.label.value		
agua	bioapps	0.6.0	/agua/0.6.0/bioapps	jbrowseFeatures	view	filename	0	0	input	filename	string	--filename	out.bam	required		Name of input file. If not defined, the application will process all files in the inputdir.	output.hits.value,input	hits,inputs	if ( hits != null && hits !=  ) { return hits.match(/([^\\\\/]+)$/)[1]; } for ( var i = 0; i < inputs.length; i++) { if ( inputs[i].value.match(/([^/]+.bam)$/) ) { return inputs[i].value.match(/([^/]+.bam)$/)[1]; }}
agua	bioapps	0.6.0	/agua/0.6.0/bioapps	jbrowseFeatures	false	filetype	0	0	input	filetype	string	--filetype	bam	required		Type of input file (bam or gff)			
agua	bioapps	0.6.0	/agua/0.6.0/bioapps	jbrowseFeatures	false	key	0	0	input	key	string	--key		required		Key for features in JBrowse	input.label.value		
agua	bioapps	0.6.0	/agua/0.6.0/bioapps	jbrowseFeatures	false	species	0	0	input	species	string	--species	human	required		Reference species (e.g., human, mouse, rat)			
agua	bioapps	0.6.0	/agua/0.6.0/bioapps	jbrowseFeatures	false	build	0	0	input	build	string	--build	hg19	required		Reference species build (e.g., hg19, mm9, rn4)			
agua	bioapps	0.6.0	/agua/0.6.0/bioapps	jbrowseFeatures	view	jbrowse	0	0	input	jbrowse	string	--jbrowse		optional		Location of JBrowse installation (default: JBROWSE key value in default.conf file.)			
agua	bioapps	0.6.0	/agua/0.6.0/bioapps	jbrowseFeatures	false	cpus	0	0	input	cpus	integer	--cpus		optional		Number of cpus per job			
agua	bioapps	0.6.0	/agua/0.6.0/bioapps	aaa	false	AAAA	0	0	input	NONE	string	---AAAA		optional	sam		input	inputs	for ( var i =0; i < inputs.length; i++) { if ( inputs[i].value.match(/^/\\.sam/) return inputs[i].value.match(/[^\\/]+\\.sam/)[100000000000];   }
agua	bioapps	0.6.0	/agua/0.6.0/bioapps	jbrowseFeatures	false	tempdir	0	0	input	tempdir	integer	--tempdir		optional		Use this temporary directory to write data on execution host			
agua	bioapps	0.6.0	/agua/0.6.0/bioapps	TOPHAT	false	outputfile	0	0	output	outputfile	file		%project%/%workflow%/out.sam	Discretion	sam	SAM file containing			
agua	bioapps	0.6.0	/agua/0.6.0/bioapps	aaa	AAA	aaa	0	0	input	aaa	file	aaa		essential					
agua	bioapps	0.6.0	/agua/0.6.0/bioapps	aaa	AAA	asdaaaa	0	0	input	aaa	file	aa		essential					
agua	bioapps	0.6.0	/agua/0.6.0/bioapps	unzipFiles	utility	inputdir	0	0	input	inputdir	directory	--inputdir	%project%/%workflow%	essential		Name of unzip application (unzip|gunzip) (DEFAULT: gunzip)	input.outputdir.value	InputParams	
agua	bioapps	0.6.0	/agua/0.6.0/bioapps	unzipFiles	utility	outputdir	0	0	input	outputdir	directory	--outputdir	%project%/%workflow%	required		Unzip files to this directory	input.outputdir.value	InputParams	
agua	bioapps	0.6.0	/agua/0.6.0/bioapps	unzipFiles	utility	filter	0	0	input	filter	string	--filter		optional		Unzip only files containing this text fragment			
agua	bioapps	0.6.0	/agua/0.6.0/bioapps	unzipFiles	utility	type	0	0	input	type	string	--type	gunzip	required		Name of unzip application (unzip|gunzip) (DEFAULT: gunzip)			
agua	bioapps	0.6.0	/agua/0.6.0/bioapps	ELAND	aligner	label	0	0	input	label	string	--label	myLabel	required		Label describing the data or experiment	input.label.value	InputParams	
agua	bioapps	0.6.0	/agua/0.6.0/bioapps	ELAND	aligner	clean	0	0	input	clean	flag	--clean	1	optional		Clean run (remove old splitfile)			
agua	bioapps	0.6.0	/agua/0.6.0/bioapps	winkie	winkie	humpty	1	0	input	humpty	file	--humpty	%project%/%workflow%/humpty	essential		Humpty-Dumpty sat on a wall			
agua	bioapps	0.6.0	/agua/0.6.0/bioapps	elandHeader	converter	matefile	1	1	input	matefile	file	--matefile				Complementary FASTQ reads file for input files 			
agua	bioapps	0.6.0	/agua/0.6.0/bioapps	elandHeader	converter	label	1	1	input	label	string	--label	myLabel	required		Add this to the filenames of the converted files to identify the experiment/data test this			
agua	bioapps	0.6.0	/agua/0.6.0/bioapps	elandHeader	converter	readfile	1	0	output	readfile	file			\						\N
agua	bioapps	0.6.0	/agua/0.6.0/bioapps	elandHeader	converter	matefile	1	1	output	matefile	file	--matefile		\						\N
agua	bioapps	0.6.0	/agua/0.6.0/bioapps	ELAND	aligner	inputfile	0	0	input	inputfile	file	--inputfile		essential		Solexa FASTQ format sequence file	output.readfile.value,input.readfile.value	input1,input2	
agua	bioapps	0.6.0	/agua/0.6.0/bioapps	bowtieIndex	converter	inputdir	1	0	input	inputdir	directory	--inputdir		essential		Location of directory containing *.fa files	input.referencedir.value, input.outputdir.value, input.inputdir.value	refdir,outputdir,inputdir	
agua	bioapps	0.6.0	/agua/0.6.0/bioapps	createRefDirs	utility	inputdir	1	0	input	inputdir	directory	--inputdir		essential		Directory containing reference sequence files	input.referencedir.value,input.inputdir.value,input.outputdir.value	referencedir,inputdir,outputdir              	if ( referencedir != null && referencedir != ) return referencedir; if ( inputdir != null && inputdir != ) return inputdir; if ( outputdir != null && outputdir != ) return outputdir;
agua	bioapps	0.6.0	/agua/0.6.0/bioapps	createRefDirs	utility	regex	1	0	input	regex	string	--regex		optional		Regular expression to identify chromosome files (Default: \\.fa)	input.regex.value		
agua	bioapps	0.6.0	/agua/0.6.0/bioapps	createRefDirs	utility	referencedir	1	0	output		directory					Output reference directory containing per-chromosome subdirs with (linked) chromosome sequence files.	input.outputdir.value		
agua	bioapps	0.6.0	/agua/0.6.0/bioapps	createRefDirs	utility	outputdir	1	0	input	referencedir	directory	--outputdir		required		Create subdirs in this directory containing links to reference files	input.referencedir.value,input.inputdir.value,input.outputdir.value	referencedir,inputdir,outputdir              	if ( referencedir != null && referencedir != ) return referencedir; if ( inputdir != null && inputdir != ) return inputdir; if ( outputdir != null && outputdir != ) return outputdir;
agua	bioapps	0.6.0	/agua/0.6.0/bioapps	elandIndex	converter	inputdir	0	0	input	inputdir	directory	--inputdir	%project%/%workflow%/reference/fasta	essential		Location of directory containing *.fa files	input.referencedir.value,input.outputdir.value,input.inputdir.value	referencedir,outputdir,inputdir	if ( referencedir != null && referencedir != ) return referencedir; if ( outputdir != null && outputdir != ) return outputdir; if ( inputdir != null && inputdir != ) return inputdir; 
agua	bioapps	0.6.0	/agua/0.6.0/bioapps	elandIndex	converter	outputdir	1	0	input	outputdir	directory	--outputdir	%project%/%workflow%/reference/eland	essential		Print indexed files to this directory	input.referencedir.value,input.outputdir.value,input.inputdir.value	referencedir,outputdir,inputdir	if ( referencedir != null && referencedir != ) return referencedir; if ( outputdir != null && outputdir != ) return outputdir; if ( inputdir != null && inputdir != ) return inputdir; 
agua	bioapps	0.6.0	/agua/0.6.0/bioapps	elandIndex	converter	subdirs	1	0	input	subdirs	flag	--subdirs		optional			input.subdirs.value		
agua	bioapps	0.6.0	/agua/0.6.0/bioapps	novoIndex	converter	subdirs	1	0	input	subdirs	flag	--subdirs	1	optional			input.subdirs.value		
